{
  "$schema": "./deployment-evidence-matrix.schema.json",
  "schemaVersion": 1,
  "evidenceKind": "access-governance-deployment",
  "artifactRoot": "test/results/access-governance-deployment",
  "requiredCoverage": [
    "startup.no_bundle",
    "bundle.lifecycle",
    "bundle.failure_rollback",
    "drift.report",
    "drift.fail",
    "drift.reconcile",
    "identity.standalone",
    "identity.oidc_entra",
    "identity.saml",
    "identity.ldap",
    "identity.multiple_provider",
    "engine.distributed",
    "engine.centralized_shared",
    "engine.external_registry",
    "engine.customer_sidecar_operaton",
    "preservation.manual_records",
    "security.secret_absence",
    "openshift.rendering",
    "openshift.failed_rollout_retention"
  ],
  "lanes": [
    {
      "id": "pr-authorization-contract",
      "title": "Authorization action, OpenAPI, documentation, and evidence-manifest contracts",
      "environmentClass": "local_contract",
      "script": "test:deployment-evidence:contract-foundation",
      "gates": ["pull_request", "local_release", "release"],
      "prerequisites": ["Node.js 24", "pnpm dependencies installed"],
      "artifacts": ["Sanitized lane receipt", "Strict action/OpenAPI/backend route inventory result"],
      "successCriteria": ["Every authenticated route is classified", "Published JSON examples parse against shared schemas", "Required evidence coverage has no missing or duplicate lane"],
      "covers": ["bundle.lifecycle", "openshift.rendering"],
      "timeoutMinutes": 10
    },
    {
      "id": "pr-bundle-lifecycle",
      "title": "Configuration preview, apply, reapply, failure, drift report, reconciliation, and manual preservation",
      "environmentClass": "local_contract",
      "script": "test:config-bundles",
      "gates": ["pull_request", "local_release", "release"],
      "prerequisites": ["Node.js 24", "No deployed identity provider or engine"],
      "artifacts": ["Sanitized lane receipt", "Vitest and CLI contract result"],
      "successCriteria": ["Exact preview hash is required for apply", "Same idempotency input replays the receipt", "Invalid apply leaves persisted state unchanged", "Drift is reported and a reviewed apply restores declared state", "Manual records survive authoritative source-scoped cleanup"],
      "covers": ["bundle.lifecycle", "bundle.failure_rollback", "drift.report", "drift.reconcile", "preservation.manual_records"],
      "timeoutMinutes": 15
    },
    {
      "id": "pr-drift-fail-closed",
      "title": "Configuration lock, drift detection, and reconciliation fail-closed behavior",
      "environmentClass": "local_contract",
      "script": "test:deployment-evidence:drift",
      "gates": ["pull_request", "local_release", "release"],
      "prerequisites": ["Node.js 24", "In-memory service fixtures"],
      "artifacts": ["Sanitized lane receipt", "Focused drift behavior test result"],
      "successCriteria": ["Config-locked mutation is rejected", "Config-warn mutation is marked drifted", "Diff reports drift", "Apply reconciles drift to in-sync"],
      "covers": ["drift.report", "drift.fail", "drift.reconcile"],
      "timeoutMinutes": 10
    },
    {
      "id": "pr-identity-contracts",
      "title": "Standalone and provider-neutral identity authorization contracts",
      "environmentClass": "local_contract",
      "script": "test:authz:identity",
      "gates": ["pull_request", "local_release", "release"],
      "prerequisites": ["Node.js 24", "Protocol mocks use only generated test credentials"],
      "artifacts": ["Sanitized lane receipt", "Provider-neutral identity contract result"],
      "successCriteria": ["Standalone login policy remains covered", "OIDC/Entra-compatible, SAML, and LDAP mappings normalize to one entitlement model", "Multiple-provider source isolation and reconciliation are enforced"],
      "covers": ["identity.standalone", "identity.oidc_entra", "identity.saml", "identity.ldap", "identity.multiple_provider"],
      "timeoutMinutes": 20
    },
    {
      "id": "pr-engine-mode-contracts",
      "title": "Distributed, shared, external-registry, and sidecar engine-mode contracts",
      "environmentClass": "local_contract",
      "script": "test:deployment-evidence:engine-modes",
      "gates": ["pull_request", "local_release", "release"],
      "prerequisites": ["Node.js 24", "Engine transports are mocked at the contract boundary"],
      "artifacts": ["Sanitized lane receipt", "Engine mode and tenant-resolution test result"],
      "successCriteria": ["Dedicated distributed engine resolution is tenant-safe", "Shared centralized engines fail closed without mappings", "External registry ownership cannot be mutated manually", "Customer-sidecar transport uses the common authorization resolver"],
      "covers": ["engine.distributed", "engine.centralized_shared", "engine.external_registry", "engine.customer_sidecar_operaton"],
      "timeoutMinutes": 20
    },
    {
      "id": "pr-secret-boundaries",
      "title": "Secret and identity-token absence across configuration surfaces",
      "environmentClass": "local_contract",
      "script": "test:secret-boundaries",
      "gates": ["pull_request", "local_release", "release"],
      "prerequisites": ["Node.js 24", "Synthetic credential canaries only"],
      "artifacts": ["Sanitized lane receipt", "Secret-boundary test result"],
      "successCriteria": ["Exports, API responses, logs, audit details, and CLI output contain no resolved secrets or bearer tokens"],
      "covers": ["security.secret_absence"],
      "timeoutMinutes": 20
    },
    {
      "id": "pr-openshift-rendering",
      "title": "OpenShift ConfigMap, Secret, readiness, and rollout rendering contracts",
      "environmentClass": "local_contract",
      "script": "test:openshift-config-bundles",
      "gates": ["pull_request", "local_release", "release"],
      "prerequisites": ["Node.js 24", "No OpenShift cluster required"],
      "artifacts": ["Sanitized lane receipt", "Kustomize and deploy-script contract result"],
      "successCriteria": ["Bundle ConfigMap and secret volumes are read-only and optional", "Readiness is fail-closed", "Rolling update retains a healthy ReplicaSet contractually"],
      "covers": ["openshift.rendering"],
      "timeoutMinutes": 10
    },
    {
      "id": "container-no-bundle-startup",
      "title": "Disposable Docker startup without a configuration bundle",
      "environmentClass": "local_container",
      "script": "test:config-bootstrap:local",
      "gates": ["local_release", "release"],
      "prerequisites": ["Docker daemon", "Free loopback ports", "Disposable Postgres volume"],
      "artifacts": ["Sanitized lane receipt", "Sanitized readiness response"],
      "successCriteria": ["Fresh deployment starts ready without a bundle", "No existing local stack or volume is modified"],
      "covers": ["startup.no_bundle"],
      "timeoutMinutes": 20
    },
    {
      "id": "container-bundle-idempotency",
      "title": "Disposable Docker bundle apply and restart idempotency",
      "environmentClass": "local_container",
      "script": "test:config-bootstrap:local:apply",
      "gates": ["local_release", "release"],
      "prerequisites": ["Docker daemon", "Free loopback ports", "Disposable Postgres volume"],
      "artifacts": ["Sanitized lane receipt", "Sanitized first-start and restart readiness receipts"],
      "successCriteria": ["Mounted bundle applies once", "Restart against the same database reuses the applied state", "No secret values are retained"],
      "covers": ["bundle.lifecycle", "preservation.manual_records", "security.secret_absence"],
      "timeoutMinutes": 25
    },
    {
      "id": "container-failed-apply-safety",
      "title": "Disposable Docker invalid bundle, hash mismatch, and unavailable-secret fail-closed behavior",
      "environmentClass": "local_container",
      "script": "test:config-bootstrap:local:fail-closed",
      "gates": ["local_release", "release"],
      "prerequisites": ["Docker daemon", "Free loopback ports", "Disposable Postgres volume"],
      "artifacts": ["Sanitized lane receipt", "Stable readiness issue codes"],
      "successCriteria": ["Every invalid startup remains unready", "Only stable sanitized diagnostics are emitted", "Cleanup removes the disposable stack"],
      "covers": ["bundle.failure_rollback", "security.secret_absence"],
      "timeoutMinutes": 30
    },
    {
      "id": "emulator-identity-protocols",
      "title": "Disposable OIDC, Entra-compatible OIDC, SAML, LDAP, and multiple-provider browser rehearsal",
      "environmentClass": "local_emulator",
      "script": "test:identity:protocol-rehearsal",
      "gates": ["local_release", "release"],
      "prerequisites": ["Docker daemon", "Playwright Chromium", "Generated local TLS material"],
      "artifacts": ["Sanitized lane receipt", "Protocol rehearsal summary without credentials"],
      "successCriteria": ["Each emulated provider signs in through its real protocol", "Mapped access is added and removed through reconciliation", "Provider source isolation remains intact"],
      "covers": ["identity.oidc_entra", "identity.saml", "identity.ldap", "identity.multiple_provider"],
      "timeoutMinutes": 45
    },
    {
      "id": "container-operaton-direct",
      "title": "Real Operaton direct-engine native authorization container",
      "environmentClass": "local_container",
      "script": "test:operaton-native-auth-container",
      "gates": ["local_release", "release"],
      "prerequisites": ["Docker daemon", "Operaton test image pull access"],
      "artifacts": ["Sanitized lane receipt", "Operaton native authorization result"],
      "successCriteria": ["Direct Operaton grants are read and enforced", "Resource-type allow and sibling deny behavior is preserved"],
      "covers": ["engine.distributed", "engine.centralized_shared"],
      "timeoutMinutes": 30
    },
    {
      "id": "container-operaton-sidecar",